"Der Vorstand schlägt der Hauptversammlung vor, den Bilanzgewinn zum 31. Dezember 2016 von EUR 5.761.688,39 (davon
Gewinnvortrag EUR 245.310,83) in Höhe von EUR 5.423.702,20 an die Gesellschafter auszuschütten und den verbleibenden Betrag
von EUR 337.986,19 auf neue Rechnung vorzutragen. Dies entspricht einer Dividende von EUR 0,35 pro bezugsberechtigter Aktie.
Der auszuschüttende Betrag vermindert sich gegebenenfalls um den Teilbetrag, der auf die zum Zeitpunkt des
Gewinnverwendungsbeschlusses im Besitz der Gesellschaft befindlichen eigenen Aktien, die gemäß § 71b AktG nicht
dividendenberechtigt sind, entfallen würde. Sofern sich zum Zeitpunkt der ordentlichen Hauptversammlung eigene Aktien im Bestand
der Gesellschaft befinden, wird der Vorstand den Gewinnverwendungsvorschlag im Rahmen seines Berichts nach § 174 Abs. 2 AktG
entsprechend präzisieren.";;2016;AG;Jahresabschluss;
Aufsichtsrat und Vorstand;;2016;AG;Jahresabschluss;
Vorstand;;2016;AG;Jahresabschluss;
"Herr Dr.-Ing. Axel Geuer, Chief Executive Officer, München
Herr Robin Laik, Chief Executive Officer, München
Herr Mark Friedrich, Chief Financial Officer, München
Herr Dr.-Ing. Kristian Schleede, Chief Restructuring Officer, Zürich/Schweiz
Herr Dr.-Ing. Wolf Cornelius, Chief Operations Officer, Waldstetten
Herr Dr.-Ing. Axel Geuer und Herr Robin Laik vertreten die Gesellschaft jeweils einzeln.
Herr Dr.-Ing. Kristian Schleede, Herr Dr.-Ing. Wolf Cornelius und Herr Mark Friedrich vertreten die Gesellschaft jeweils zusammen mit
einem weiteren Vorstandsmitglied oder gemeinsam mit einem Prokuristen.";;2016;AG;Jahresabschluss;
Aufsichtsrat;;2016;AG;Jahresabschluss;
"Mitglieder des Aufsichtsrats sind:
Herr Prof. Dr. iur. Micha Bloching, Steuerberater, München (Vorsitzender)
Herr Volker Rofalski, Diplom-Kaufmann, Geschäftsführer Only Natural Munich GmbH, München (stellvertretender Vorsitzender)
Herr Dr. Ulrich Hauck, Vorstand Finanzen, Schaeffler AG, Ottobrunn";;2016;AG;Jahresabschluss;
Gesamtbezüge des Aufsichtsrates;;2016;AG;Jahresabschluss;
"Die Mitglieder des Aufsichtsrates haben Anspruch auf Vergütung für ihre Tätigkeiten in Höhe von insgesamt jährlich EUR 120.000,00
zzgl. gesetzlicher Umsatzsteuer gemäß Hauptversammlungsbeschluss vom 3. Juni 2016.";;2016;AG;Jahresabschluss;
